<?xml version="1.0" encoding="UTF-8"?>
<employes xmlns:xsi="http://www.w3.org/2001/XMLSchema-instance" 
xsi:noNamespaceSchemaLocation="employes.xsd">
	<employe>	
		<prenom>Georges</prenom>
		<nom>Durand</nom>
		<addresse>37 grande rue</addresse>
		<ville>Montb√©liard</ville>
		<pays>France</pays>
	</employe>
	<employe>	
		<prenom>Albert</prenom>
		<nom>Dupont</nom>
	</employe>

</employes>
